{
  "id": "11111111-1111-4111-8111-111111111111",
  "type": "table.occupied",
  "schemaVersion": 1,
  "occurredAt": "2026-08-29T18:03:00Z",
  "organisationId": "22222222-2222-4222-8222-222222222222",
  "locationId": "33333333-3333-4333-8333-333333333333",
  "actorRef": "user:waiter-1",
  "deviceId": "44444444-4444-4444-8444-444444444444",
  "entityType": "table",
  "entityId": "55555555-5555-4555-8555-555555555555",
  "entityVersion": 2,
  "commandId": "66666666-6666-4666-8666-666666666666",
  "correlationId": "66666666-6666-4666-8666-666666666666",
  "data": {
    "tableId": "55555555-5555-4555-8555-555555555555",
    "sessionId": "77777777-7777-4777-8777-777777777777",
    "status": "occupied",
    "partySize": 4
  }
}
