{
  "id": "88888888-8888-4888-8888-888888888888",
  "type": "assist.requested",
  "schemaVersion": 1,
  "occurredAt": "2026-08-29T18:48:00Z",
  "organisationId": "22222222-2222-4222-8222-222222222222",
  "locationId": "33333333-3333-4333-8333-333333333333",
  "actorRef": "guest",
  "entityType": "assist",
  "entityId": "99999999-9999-4999-8999-999999999999",
  "entityVersion": 1,
  "data": {
    "assistId": "99999999-9999-4999-8999-999999999999",
    "tableId": "55555555-5555-4555-8555-555555555555",
    "status": "pending",
    "source": "guest_qr",
    "note": "bill"
  }
}
